judul,desc
Attack on Titan,"After his hometown is destroyed and his mother is killed, young Eren Jaeger vows to cleanse the earth of the giant humanoid Titans that have brought humanity to the brink of extinction."
Rick and Morty,An animated series that follows the exploits of a super scientist and his not-so-bright grandson.
Bob's Burgers,Bob Belcher runs his dream restaurant with his wife and three children as their last hope of holding the family together.
My Hero Academia,A superhero-loving boy without any powers is determined to enroll in a prestigious hero academy and learn what it really means to be a hero.
Demon Slayer: Kimetsu no Yaiba,"A family is attacked by demons and only two members survive - Tanjiro and his sister Nezuko, who is turning into a demon slowly. Tanjiro sets out to become a demon slayer to avenge his family and cure his sister."
Vinland Saga,Thorfinn pursues a journey with his father's killer in order to take revenge and end his life in a duel as an honorable warrior and pay his father a homage.
BoJack Horseman,"BoJack Horseman was the star of the hit television show ""Horsin' Around"" in the '80s and '90s, but now he's washed up, living in Hollywood, complaining about everything, and wearing colorful sweaters."
Spider-Man: Into the Spider-Verse,"Teen Miles Morales becomes the Spider-Man of his universe, and must join with five spider-powered individuals from other dimensions to stop a threat for all realities."
Bluey,The slice-of-life adventures of an Australian Blue Heeler Cattle Dog puppy as she has fun with her family and friends in everyday situations.
Avatar: The Last Airbender,"In a war-torn world of elemental magic, a young boy reawakens to undertake a dangerous mystic quest to fulfill his destiny as the Avatar, and bring peace to the world."
"Love, Death & Robots","A collection of animated short stories that span various genres including science fiction, fantasy, horror and comedy."
Puss in Boots,"An outlaw cat, his childhood egg-friend, and a seductive thief kitty set out in search for the eggs of the fabled Golden Goose to clear his name, restore his lost honor, and regain the trust of his mother and town."
Star Wars: The Clone Wars,Jedi Knights lead the Grand Army of the Republic against the droid army of the Separatists.
Harley Quinn,"The series focuses on a single Harley Quinn, who sets off to make it on her own in Gotham City."
Spirited Away,"During her family's move to the suburbs, a sullen 10-year-old girl wanders into a world ruled by gods, witches, and spirits, and where humans are changed into beasts."
Miraculous: Tales of Ladybug & Cat Noir,"Marinette and Adrien, two normal teens, transform into superheroes Ladybug and Cat Noir when an evil threatens their city."
Cars,"On the way to the biggest race of his life, a hotshot rookie race car gets stranded in a rundown town, and learns that winning isn't everything in life."
Zootopia,"In a city of anthropomorphic animals, a rookie bunny cop and a cynical con artist fox must work together to uncover a conspiracy."
Archer,Covert black ops and espionage take a back seat to zany personalities and relationships between secret agents and drones.
Moana,"In Ancient Polynesia, when a terrible curse incurred by the Demigod Maui reaches Moana's island, she answers the Ocean's call to seek out the Demigod to set things right."
The Lion King,"After the murder of his father, a young lion prince flees his kingdom only to learn the true meaning of responsibility and bravery."
Ratatouille,A rat who can cook makes an unusual alliance with a young kitchen worker at a famous Paris restaurant.
Naruto,"Naruto Uzumaki, a mischievous adolescent ninja, struggles as he searches for recognition and dreams of becoming the Hokage, the village's leader and strongest ninja."
Shrek,"A mean lord exiles fairytale creatures to the swamp of a grumpy ogre, who must go on a quest and rescue a princess for the lord in order to get his land back."
Frozen,"When the newly crowned Queen Elsa accidentally uses her power to turn things into ice to curse her home in infinite winter, her sister Anna teams up with a mountain man, his playful reindeer, and a snowman to change the weather condition."
American Dad!,"The random escapades of Stan Smith, a conservative C.I.A. Agent dealing with family life, and keeping America safe, all in the most absurd way possible."
Hunter x Hunter,"Gon Freecss aspires to become a Hunter, an exceptional being capable of greatness. With his friends and his potential, he seeks out his father, who left him when he was younger."
Naruto: Shippuden,"Naruto Uzumaki, is a loud, hyperactive, adolescent ninja who constantly searches for approval and recognition, as well as to become Hokage, who is acknowledged as the leader and strongest of all ninja in the village."
Adventure Time,"A twelve-year-old boy and his best friend, a wise twenty-eight-year-old dog with magical powers, go on a series of surreal adventures in a remote future."
Sing,"In a city of humanoid animals, a hustling theater impresario's attempt to save his theater with a singing competition becomes grander than he anticipates even as its finalists find that their lives will never be the same."
Death Note,An intelligent high school student goes on a secret crusade to eliminate criminals from the world after discovering a notebook capable of killing anyone whose name is written into it.
The Incredibles,"While trying to lead a quiet suburban life, a family of undercover superheroes are forced into action to save the world."
Howl's Moving Castle,"When an unconfident young woman is cursed with an old body by a spiteful witch, her only chance of breaking the spell lies with a self-indulgent yet insecure young wizard and his companions in his legged, walking castle."
JoJo's Bizarre Adventure,"The story of the Joestar family, who are possessed with intense psychic strength, and the adventures each member encounters throughout their lives."
Gravity Falls,"Twin siblings Dipper and Mabel Pines spend the summer at their great-uncle's tourist trap in the enigmatic Gravity Falls, Oregon."
"Monsters, Inc.","In order to power the city, monsters have to scare children so that they scream. However, the children are toxic to the monsters, and after a child gets through, two monsters realize things may not be what they think."
Inside Out,"After young Riley is uprooted from her Midwest life and moved to San Francisco, her emotions - Joy, Fear, Anger, Disgust and Sadness - conflict on how best to navigate a new city, house, and school."
Jujutsu Kaisen,A boy swallows a cursed talisman - the finger of a demon - and becomes cursed himself. He enters a shaman's school to be able to locate the demon's other body parts and thus exorcise himself.
Up,"78-year-old Carl Fredricksen travels to Paradise Falls in his house equipped with balloons, inadvertently taking a young stowaway."
Kung Fu Panda,"To everyone's surprise, including his own, Po, an overweight, clumsy panda, is chosen as protector of the Valley of Peace. His suitability will soon be tested as the valley's arch-enemy is on his way."
Coco,"Aspiring musician Miguel, confronted with his family's ancestral ban on music, enters the Land of the Dead to find his great-great-grandfather, a legendary singer."
The Owl House,"Accidentally sent to the world of the Boiling Isles before a trip to summer camp, a teenage human named Luz longs to become a witch and is aided by rebellious Eda and pint-sized demon King."
Your Name.,"Two strangers find themselves linked in a bizarre way. When a connection forms, will distance be the only thing to keep them apart?"
The Princess and the Frog,"A waitress, desperate to fulfill her dreams as a restaurant owner, is set on a journey to turn a frog prince back into a human being, but she has to face the same problem after she kisses him."
Monster,A brilliant neurosurgeon finds his life in utter turmoil after getting involved with a psychopathic former patient.
Finding Nemo,"After his son is captured in the Great Barrier Reef and taken to Sydney, a timid clownfish sets out on a journey to bring him home."
Tangled,"The magically long-haired Rapunzel has spent her entire life in a tower, but now that a runaway thief has stumbled upon her, she is about to discover the world for the first time, and who she really is."
Bleach,"High school student Ichigo Kurosaki, who has the ability to see ghosts, gains soul reaper powers from Rukia Kuchiki and sets out to save the world from ""Hollows""."
How to Train Your Dragon,"A hapless young Viking who aspires to hunt dragons becomes the unlikely friend of a young dragon himself, and learns there may be more to the creatures than he assumed."
WALL·E,"In the distant future, a small waste-collecting robot inadvertently embarks on a space journey that will ultimately decide the fate of mankind."
